{
  "meta": {
    "pageKey": "pet-timeline",
    "platform": "wechat-miniprogram",
    "penFile": "/Volumes/Beelink/software/pet-cloud-consultation-mini-program/design/frontendMobileScreens.pen",
    "frameId": "zqXpi",
    "frameName": "单宠物成长档案页 Pet Growth Profile"
  },
  "layout": {
    "background": "#F5F4F1",
    "contentPadding": [8, 16, 24, 16],
    "sectionGap": 20,
    "safeAreaTop": true
  },
  "tokens": {
    "colors": {
      "pageBackground": "#F5F4F1",
      "surface": "#FFFFFF",
      "surfaceSoft": "#F7F4FC",
      "textPrimary": "#1A1918",
      "textSecondary": "#6D6C6A",
      "textMuted": "#9C9B99",
      "accentPrimary": "#5C35D6",
      "accentWarm": "#D89575",
      "borderSoft": "#E5E4E1",
      "borderPurple": "#E8E0F4"
    },
    "radius": {
      "heroImage": 28,
      "card": 20,
      "button": 18
    },
    "typography": {
      "navTitle": { "fontFamily": "Inter", "fontSize": 16, "fontWeight": "600" },
      "heroTitle": { "fontFamily": "Inter", "fontSize": 28, "fontWeight": "700" },
      "storyTitle": { "fontFamily": "Inter", "fontSize": 26, "fontWeight": "700" },
      "body": { "fontFamily": "Inter", "fontSize": 14, "fontWeight": "500" },
      "bodyStrong": { "fontFamily": "Inter", "fontSize": 15, "fontWeight": "600" },
      "caption": { "fontFamily": "Inter", "fontSize": 10, "fontWeight": "700" },
      "button": { "fontFamily": "Inter", "fontSize": 14, "fontWeight": "700" }
    }
  },
  "sections": [
    {
      "key": "status_bar",
      "type": "status_bar",
      "sourceNodeId": "Fzwht",
      "copy": ["9:41", "5G   100%"]
    },
    {
      "key": "page_header",
      "type": "page_title",
      "sourceNodeId": "ZH1b1",
      "copy": ["成长档案"]
    },
    {
      "key": "hero_photo",
      "type": "growth_hero_photo",
      "sourceNodeId": "LfhEE"
    },
    {
      "key": "story_block_primary",
      "type": "growth_story_block_primary",
      "sourceNodeId": "sU52Q",
      "copy": [
        "03/24",
        "这是最近最像团子的一天。",
        "它在沙发边待了很久，眼神安静，动作也慢下来。那种放松不是靠一条数据得来的，而是镜头里一下就能看见的。"
      ]
    },
    {
      "key": "story_photo_secondary",
      "type": "growth_story_photo_secondary",
      "sourceNodeId": "T56HI"
    },
    {
      "key": "story_block_secondary",
      "type": "growth_story_block_secondary",
      "sourceNodeId": "NXqF9",
      "copy": [
        "03/20",
        "它开始更愿意主动靠近人。",
        "最近会主动走过来，也更愿意在身边停留。这种变化很轻，但很真切，很适合写成一句以后还想回看的小记。",
        "今天最值得留下来的，不是它做了什么，而是它看起来很安心。",
        "把这一刻写下来，以后再看会很珍贵。"
      ]
    },
    {
      "key": "bottom_action",
      "type": "growth_profile_bottom_action",
      "sourceNodeId": "xZTph",
      "copy": ["上传照片", "写成长小记"]
    }
  ],
  "dataBindings": [
    {
      "sectionKey": "hero_photo",
      "api": "GET /api/pets/{petId}/growth-profile",
      "fields": ["coverImageUrl"]
    },
    {
      "sectionKey": "story_block_primary",
      "api": "GET /api/pets/{petId}/growth-profile",
      "fields": ["featuredStory.dateLabel", "featuredStory.title", "featuredStory.summary"]
    },
    {
      "sectionKey": "story_photo_secondary",
      "api": "GET /api/pets/{petId}/growth-profile",
      "fields": ["secondaryStory.imageUrl"]
    },
    {
      "sectionKey": "story_block_secondary",
      "api": "GET /api/pets/{petId}/growth-profile",
      "fields": ["secondaryStory.dateLabel", "secondaryStory.title", "secondaryStory.summary", "secondaryStory.quote", "secondaryStory.quoteHint"]
    }
  ],
  "actions": [
    { "name": "uploadGrowthPhoto", "target": "growth-photo-upload-flow", "sectionKey": "bottom_action" },
    { "name": "writeGrowthNote", "target": "growth-note-create-flow", "sectionKey": "bottom_action" }
  ],
  "verification": {
    "sourceScreenshotNodeId": "zqXpi",
    "criticalCheckpoints": [
      "page reads as a calm visual growth journal instead of a health management or timeline dashboard",
      "the first hero photo and large editorial headline dominate the page before any action area",
      "secondary story content stays image-led and quote-led, without reintroducing cards full of metrics",
      "bottom actions split into two equal options: upload a photo and write a short growth note"
    ]
  }
}
