{
  "meta": {
    "pageKey": "consultation-list",
    "platform": "wechat-miniprogram",
    "penFile": "/Volumes/Beelink/software/pet-cloud-consultation-mini-program/design/frontendMobileScreens.pen",
    "frameId": "TO5jB",
    "frameName": "问诊列表页 Consultation List"
  },
  "layout": {
    "background": "#F8F8F8",
    "contentPadding": [8, 16, 24, 16],
    "sectionGap": 14,
    "safeAreaTop": true
  },
  "tokens": {
    "colors": {
      "pageBackground": "#F8F8F8",
      "surface": "#FFFFFF",
      "surfaceSoft": "#FCFBFF",
      "surfaceWarm": "#FFF7F1",
      "textPrimary": "#2B2438",
      "textSecondary": "#8A81A0",
      "textMuted": "#B4ABC8",
      "textWarm": "#C47C36",
      "accentPrimary": "#5C35D6",
      "accentWarm": "#C47C36",
      "borderSoft": "#F3EEF9",
      "borderWarm": "#F0E1D6"
    },
    "radius": {
      "heroCard": 22,
      "card": 18,
      "pill": 999,
      "button": 16
    },
    "typography": {
      "navTitle": { "fontFamily": "Inter", "fontSize": 16, "fontWeight": "600" },
      "heroTitle": { "fontFamily": "Inter", "fontSize": 20, "fontWeight": "700" },
      "cardTitle": { "fontFamily": "Inter", "fontSize": 15, "fontWeight": "700" },
      "body": { "fontFamily": "Inter", "fontSize": 11, "fontWeight": "500" },
      "bodyStrong": { "fontFamily": "Inter", "fontSize": 10, "fontWeight": "700" },
      "button": { "fontFamily": "Inter", "fontSize": 14, "fontWeight": "700" }
    }
  },
  "sections": [
    { "key": "status_bar", "type": "status_bar", "sourceNodeId": "9Ut05", "copy": ["9:41", "5G   100%"] },
    { "key": "page_header", "type": "page_title", "sourceNodeId": "NNynl", "copy": ["我的咨询"] },
    {
      "key": "consult_list_hero",
      "type": "consultation_list_hero",
      "sourceNodeId": "6bGy1",
      "copy": ["2 条进行中", "1 条加急", "最近 2 条咨询", "先看待医生回复和待你补充，再回看已结束记录。"]
    },
    {
      "key": "consult_tabs",
      "type": "consultation_list_tabs",
      "sourceNodeId": "4IvmE",
      "copy": ["全部", "待回复", "进行中", "已结束"]
    },
    {
      "key": "consult_cards",
      "type": "consultation_list_cards",
      "sourceNodeId": "h9WV4",
      "copy": ["加急问诊", "待你补充资料", "团子 · 持续腹泻伴精神变差", "周医生 · 城市宠物医院 · 03/26 09:20", "先补充症状变化、频次和最新照片", "去补充", "普通咨询", "待你查看", "奶盖 · 皮肤瘙痒反复，想确认洗护方案", "李医生 · 伴宠中心医院 · 12 分钟前回复", "费用 ¥39", "查看回复"]
    },
    { "key": "bottom_primary_action", "type": "primary_button", "sourceNodeId": "g4fZH", "copy": ["发起问诊"] },
    { "key": "bottom_secondary_action", "type": "secondary_button", "sourceNodeId": "9FAdv", "copy": ["加急通道"] }
  ],
  "dataBindings": [
    {
      "sectionKey": "consult_list_hero",
      "api": "GET /api/consultation/list",
      "fields": ["summary.pendingReplyCount", "summary.urgentCount", "summary.priorityCount", "summary.description"]
    },
    {
      "sectionKey": "consult_tabs",
      "fields": ["activeTab", "tabs[]"]
    },
    {
      "sectionKey": "consult_cards",
      "api": "GET /api/consultation/list",
      "fields": ["consultations[].id", "consultations[].urgentTypeLabel", "consultations[].statusLabel", "consultations[].petName", "consultations[].title", "consultations[].doctorName", "consultations[].hospitalName", "consultations[].timeLabel", "consultations[].feeLabel", "consultations[].ctaLabel"]
    }
  ],
  "actions": [
    { "name": "switchConsultationTab", "target": "consultation-list-tab-switch", "sectionKey": "consult_tabs" },
    { "name": "openConsultationChat", "target": "/pages/consultation/chat?id={consultationId}", "sectionKey": "consult_cards" },
    { "name": "openConsultationCreate", "target": "/pages/consultation/doctor-list", "sectionKey": "bottom_primary_action" },
    { "name": "openUrgentConsultation", "target": "/pages/consultation/urgent/index", "sectionKey": "bottom_secondary_action" }
  ],
  "verification": {
    "sourceScreenshotNodeId": "TO5jB",
    "criticalCheckpoints": [
      "list opens with a response-priority hero instead of immediately dropping into tabs",
      "tabs remain lightweight and subordinate to the priority messaging",
      "cards distinguish urgent and regular consultations with warm vs purple emphasis",
      "bottom actions separate normal entry and urgent channel as parallel choices"
    ]
  }
}
